[
  {
    "schema": 1,
    "id": "ensure.make-certain.v.analysis.proposal.morphology.v1",
    "lexeme_id": "ensure.make-certain.v",
    "text": "ensure",
    "kind": "morphological",
    "review": {
      "status": "pending",
      "reviewer": null,
      "reviewed_at": null,
      "notes": "Research candidate only: causative en- plus the free adjective base sure in its certain-result reading. Modern prefix and whole-word evidence support a meaningful teaching boundary, beyond historical origin alone. The exact en + sure spelling requires no deletion or alternation. The provisional prefix and base identities are not merged with existing pending en-, empathy, suffix -en or assure families. Independent linguistic and canonical-family review remains required. This analysis covers the canonical surface ensure; accepted lexical variant insure stays accepted without an invented negative-in or alternate-surface graph.",
      "references": [
        "https://www.oxfordlearnersdictionaries.com/definition/english/ensure",
        "https://www.oxfordlearnersdictionaries.com/definition/english/en_1",
        "https://www.oxfordlearnersdictionaries.com/definition/english/sure_1",
        "https://www.collinsdictionary.com/dictionary/english/ensure",
        "https://www.collinsdictionary.com/dictionary/english/en"
      ]
    },
    "parts": [
      {
        "id": "p1",
        "canonical_id": "english.affix.en.causative",
        "type": "prefix",
        "canonical": "en-",
        "surface": "en",
        "break_offsets": []
      },
      {
        "id": "p2",
        "canonical_id": "english.stem.sure.certain",
        "type": "stem",
        "canonical": "sure",
        "surface": "sure",
        "break_offsets": []
      }
    ],
    "nodes": [
      {
        "id": "n1",
        "left": "p1",
        "right": "p2",
        "surface": "ensure",
        "rule": "prefix_attachment",
        "break_offsets": []
      }
    ],
    "roots": [
      "n1"
    ]
  },
  {
    "schema": 1,
    "id": "inform.give-information.v.analysis.proposal.morphology.v1",
    "lexeme_id": "inform.give-information.v",
    "text": "inform",
    "kind": "atomic",
    "review": {
      "status": "pending",
      "reviewer": null,
      "reviewed_at": null,
      "notes": "Research candidate only: retain inform as an intact modern teaching base for giving information. Its historical shaping formation does not establish a transparent negative-in plus document-form analysis. Atomic describes the chosen teaching unit, not a claim that the word lacks historical or derivative morphology. The provisional identity remains separate from the unreviewed clinical morph.inform stem. A future reviewed inform + -ed relationship may be legitimate, but no shared runtime identity, clinical phrase graph, informed adjective or specialist approval is granted here.",
      "references": [
        "https://www.oxfordlearnersdictionaries.com/definition/english/inform",
        "https://www.oxfordlearnersdictionaries.com/definition/english/informed"
      ]
    },
    "parts": [
      {
        "id": "p1",
        "canonical_id": "english.atomic.inform.give-information",
        "type": "atomic",
        "canonical": "inform",
        "surface": "inform",
        "break_offsets": []
      }
    ],
    "nodes": [],
    "roots": [
      "p1"
    ]
  },
  {
    "schema": 1,
    "id": "collect.gather.v.analysis.proposal.morphology.v1",
    "lexeme_id": "collect.gather.v",
    "text": "collect",
    "kind": "atomic",
    "review": {
      "status": "pending",
      "reviewer": null,
      "reviewed_at": null,
      "notes": "Research candidate only for the independently accepted gathering sense: retain collect as an intact modern teaching base. The sources describe historical col-/com- and Latin legere/collect- development; they do not by themselves establish a transparent modern col + lect game lesson. This is not a universal claim of monomorphemicity. The sense-specific provisional identity avoids silently equating gathering with the pending pickup uses of morph.collect. The old morph.collect graph, related collection/pickup/payment entries and their review gates remain exact. Same lexical ID preserves historical skill records, whose old pickup evidence cannot be certified as gathering mastery by this morphology proposal.",
      "references": [
        "https://www.oxfordlearnersdictionaries.com/definition/english/collect_1",
        "https://www.collinsdictionary.com/dictionary/english/collect"
      ]
    },
    "parts": [
      {
        "id": "p1",
        "canonical_id": "english.atomic.collect.gather",
        "type": "atomic",
        "canonical": "collect",
        "surface": "collect",
        "break_offsets": []
      }
    ],
    "nodes": [],
    "roots": [
      "p1"
    ]
  }
]
